{
  "version": "0.6.2",
  "description": "Regression set for AnswerPlan route hardening, requested_style handling, conversation follow-ups, semantic routing fallback, and no-LLM deterministic QA.",
  "cases": [
    {
      "id": "small_talk_greeting",
      "query": "안녕",
      "expected_route": "chitchat",
      "expected_intent": "small_talk",
      "expected_content_type": null,
      "expected_canonical_id": null,
      "expected_item_id": null,
      "required_fragments": ["안녕하세요", "공식 데이터 조회", "궁금한 항목 이름"],
      "forbidden_fragments": ["말라니", "5성 캐릭터입니다", "성유물 세트입니다"]
    },
    {
      "id": "reliquary_emblem_effect",
      "query": "절연의 기치 효과",
      "expected_route": "basic_lookup",
      "expected_intent": "reliquary_effect_lookup",
      "expected_content_type": "reliquary",
      "expected_canonical_id": "project_amber:reliquary:15020",
      "expected_item_id": "15020",
      "required_fragments": ["절연의 기치", "원소 충전 효율+20%", "최대 75%", "성유물 반환의 신비 획득"],
      "forbidden_fragments": ["추천", "티어", "추측"]
    },
    {
      "id": "reliquary_gladiator_effect",
      "query": "검투사의 피날레 효과",
      "expected_route": "basic_lookup",
      "expected_intent": "reliquary_effect_lookup",
      "expected_content_type": "reliquary",
      "expected_canonical_id": "project_amber:reliquary:15001",
      "expected_item_id": "15001",
      "required_fragments": ["검투사의 피날레", "공격력+18%", "일반 공격으로 주는 피해가 35% 증가", "성유물 반환의 신비 획득"],
      "forbidden_fragments": ["추천", "티어", "추측"]
    },
    {
      "id": "reliquary_viridescent_effect",
      "query": "청록색 그림자 성유물 효과",
      "expected_route": "basic_lookup",
      "expected_intent": "reliquary_effect_lookup",
      "expected_content_type": "reliquary",
      "expected_canonical_id": "project_amber:reliquary:15002",
      "expected_item_id": "15002",
      "required_fragments": ["청록색 그림자", "바람 원소 피해 보너스+15%", "내성이 40% 감소", "지속 시간: 10초"],
      "forbidden_fragments": ["추천", "티어", "추측"]
    },
    {
      "id": "reliquary_wanderers_effect",
      "query": "대지를 유랑하는 악단 효과",
      "expected_route": "basic_lookup",
      "expected_intent": "reliquary_effect_lookup",
      "expected_content_type": "reliquary",
      "expected_canonical_id": "project_amber:reliquary:15003",
      "expected_item_id": "15003",
      "required_fragments": ["대지를 유랑하는 악단", "원소 마스터리+80pt", "법구 또는 활", "강공격으로 주는 피해가 35% 증가"],
      "forbidden_fragments": ["추천", "티어", "추측"]
    },
    {
      "id": "reliquary_crimson_witch_effect",
      "query": "불타오르는 화염의 마녀 효과",
      "expected_route": "basic_lookup",
      "expected_intent": "reliquary_effect_lookup",
      "expected_content_type": "reliquary",
      "expected_canonical_id": "project_amber:reliquary:15006",
      "expected_item_id": "15006",
      "required_fragments": ["불타오르는 화염의 마녀", "불 원소 피해 보너스+15%", "증발, 융해", "최대 중첩수: 3회"],
      "forbidden_fragments": ["추천", "티어", "추측"]
    },
    {
      "id": "reliquary_noblesse_effect",
      "query": "옛 왕실의 의식 효과",
      "expected_route": "basic_lookup",
      "expected_intent": "reliquary_effect_lookup",
      "expected_content_type": "reliquary",
      "expected_canonical_id": "project_amber:reliquary:15007",
      "expected_item_id": "15007",
      "required_fragments": ["옛 왕실의 의식", "원소폭발로 주는 피해+20%", "공격력이 20% 증가", "중첩되지 않는다"],
      "forbidden_fragments": ["추천", "티어", "추측"]
    },
    {
      "id": "weapon_mistsplitter_info",
      "query": "안개를 가르는 회광 정보",
      "expected_route": "basic_lookup",
      "expected_intent": "weapon_basic_info",
      "expected_content_type": "weapon",
      "expected_canonical_id": "project_amber:weapon:11509",
      "expected_item_id": "11509",
      "expected_requested_style": "default",
      "required_fragments": ["안개를 가르는 회광", "5성 한손검", "치명타 피해", "무절(霧切) 어검", "R1:"],
      "forbidden_fragments": ["추천", "티어", "추측", "R5:"]
    },
    {
      "id": "weapon_mistsplitter_detail_refinements",
      "query": "안개를 가르는 회광 R1부터 R5까지 보여줘",
      "expected_route": "basic_lookup",
      "expected_intent": "weapon_basic_info",
      "expected_content_type": "weapon",
      "expected_canonical_id": "project_amber:weapon:11509",
      "expected_item_id": "11509",
      "expected_requested_style": "detail",
      "required_fragments": ["안개를 가르는 회광", "무절(霧切) 어검", "R1:", "R5:"],
      "forbidden_fragments": ["추천", "티어", "추측"]
    },
    {
      "id": "weapon_staff_of_homa_info",
      "query": "호마의 지팡이 정보",
      "expected_route": "basic_lookup",
      "expected_intent": "weapon_basic_info",
      "expected_content_type": "weapon",
      "expected_canonical_id": "project_amber:weapon:13501",
      "expected_item_id": "13501",
      "expected_requested_style": "default",
      "required_fragments": ["호마의 지팡이", "5성 장병기", "치명타 피해", "자유의 붉은 나비", "R1:"],
      "forbidden_fragments": ["추천", "티어", "추측", "R5:"]
    },
    {
      "id": "weapon_engulfing_lightning_info",
      "query": "예초의 번개 정보",
      "expected_route": "basic_lookup",
      "expected_intent": "weapon_basic_info",
      "expected_content_type": "weapon",
      "expected_canonical_id": "project_amber:weapon:13509",
      "expected_item_id": "13509",
      "expected_requested_style": "default",
      "required_fragments": ["예초의 번개", "5성 장병기", "원소 충전 효율", "불시의 꿈·영원한 부뚜막", "R1:"],
      "forbidden_fragments": ["추천", "티어", "추측", "R5:"]
    },
    {
      "id": "weapon_wolfs_gravestone_info",
      "query": "늑대의 말로 정보",
      "expected_route": "basic_lookup",
      "expected_intent": "weapon_basic_info",
      "expected_content_type": "weapon",
      "expected_canonical_id": "project_amber:weapon:12502",
      "expected_item_id": "12502",
      "expected_requested_style": "default",
      "required_fragments": ["늑대의 말로", "5성 양손검", "공격력", "늑대 같은 사냥꾼", "HP가 30% 미만"],
      "forbidden_fragments": ["추천", "티어", "추측", "R5:"]
    },
    {
      "id": "weapon_skyward_blade_info",
      "query": "천공의 검 정보",
      "expected_route": "basic_lookup",
      "expected_intent": "weapon_basic_info",
      "expected_content_type": "weapon",
      "expected_canonical_id": "project_amber:weapon:11502",
      "expected_item_id": "11502",
      "expected_requested_style": "default",
      "required_fragments": ["천공의 검", "5성 한손검", "원소 충전 효율", "높은 하늘을 뚫는 이빨", "치명타 확률이 4%"],
      "forbidden_fragments": ["추천", "티어", "추측", "R5:"]
    },
    {
      "id": "weapon_primordial_jade_cutter_info",
      "query": "반암결록 정보",
      "expected_route": "basic_lookup",
      "expected_intent": "weapon_basic_info",
      "expected_content_type": "weapon",
      "expected_canonical_id": "project_amber:weapon:11505",
      "expected_item_id": "11505",
      "expected_requested_style": "default",
      "required_fragments": ["반암결록", "5성 한손검", "치명타 확률", "수호자의 무구한 마음", "HP가 20% 증가"],
      "forbidden_fragments": ["추천", "티어", "추측", "R5:"]
    },
    {
      "id": "character_furina_basic",
      "query": "푸리나 기본정보",
      "expected_route": "basic_lookup",
      "expected_intent": "character_basic_info",
      "expected_content_type": "avatar",
      "expected_canonical_id": "project_amber:avatar:10000089",
      "expected_item_id": "10000089",
      "required_fragments": ["푸리나는 폰타인 출신의 5성 물 원소 캐릭터입니다.", "한손검", "10월 13일", "코레고스자리"],
      "forbidden_fragments": ["추천", "티어", "추측", "C1"]
    },
    {
      "id": "character_furina_brief_summary_phrase",
      "query": "푸리나에 대해서 요약해줘",
      "expected_route": "basic_lookup",
      "expected_intent": "character_basic_info",
      "expected_content_type": "avatar",
      "expected_canonical_id": "project_amber:avatar:10000089",
      "expected_item_id": "10000089",
      "expected_requested_style": "brief",
      "required_fragments": ["푸리나는 폰타인 출신의 5성 물 원소 캐릭터입니다.", "한손검", "코레고스자리"],
      "forbidden_fragments": ["추천", "티어", "추측", "CV"]
    },
    {
      "id": "character_raiden_basic",
      "query": "라이덴 쇼군 기본정보",
      "expected_route": "basic_lookup",
      "expected_intent": "character_basic_info",
      "expected_content_type": "avatar",
      "expected_canonical_id": "project_amber:avatar:10000052",
      "expected_item_id": "10000052",
      "required_fragments": ["라이덴 쇼군은 이나즈마 출신의 5성 번개 원소 캐릭터입니다.", "장병기", "6월 26일", "천하인자리"],
      "forbidden_fragments": ["추천", "티어", "추측", "C1"]
    },
    {
      "id": "character_zhongli_basic",
      "query": "종려 기본정보",
      "expected_route": "basic_lookup",
      "expected_intent": "character_basic_info",
      "expected_content_type": "avatar",
      "expected_canonical_id": "project_amber:avatar:10000030",
      "expected_item_id": "10000030",
      "required_fragments": ["종려는 리월 출신의 5성 바위 원소 캐릭터입니다.", "장병기", "12월 31일", "암왕제군자리", "바위 원소 피해 보너스"],
      "forbidden_fragments": ["추천", "티어", "추측", "C1"]
    },
    {
      "id": "character_nahida_basic",
      "query": "나히다 기본정보",
      "expected_route": "basic_lookup",
      "expected_intent": "character_basic_info",
      "expected_content_type": "avatar",
      "expected_canonical_id": "project_amber:avatar:10000073",
      "expected_item_id": "10000073",
      "required_fragments": ["나히다는 수메르 출신의 5성 풀 원소 캐릭터입니다.", "법구", "10월 27일", "지혜의 주인자리"],
      "forbidden_fragments": ["추천", "티어", "추측", "C1"]
    },
    {
      "id": "character_venti_basic",
      "query": "벤티 기본정보",
      "expected_route": "basic_lookup",
      "expected_intent": "character_basic_info",
      "expected_content_type": "avatar",
      "expected_canonical_id": "project_amber:avatar:10000022",
      "expected_item_id": "10000022",
      "required_fragments": ["벤티는 몬드 출신의 5성 바람 원소 캐릭터입니다.", "활", "6월 16일", "가선자리"],
      "forbidden_fragments": ["추천", "티어", "추측", "C1"]
    },
    {
      "id": "character_hutao_basic",
      "query": "호두 기본정보",
      "expected_route": "basic_lookup",
      "expected_intent": "character_basic_info",
      "expected_content_type": "avatar",
      "expected_canonical_id": "project_amber:avatar:10000046",
      "expected_item_id": "10000046",
      "required_fragments": ["호두는 리월 출신의 5성 불 원소 캐릭터입니다.", "장병기", "7월 15일", "나비자리"],